[
  {
    "id": "chase_freedom_flex",
    "issuer_id": "chase",
    "name": "Chase Freedom Flex",
    "network": "visa",
    "reward_unit": "cashback_percent",
    "reward_currency": "cashback",
    "base_earn_rate": 1,
    "reward_rules": [
      {
        "rule_id": "5x_travel_portal",
        "categories": [
          "TRAVEL_PORTAL",
          "DINING",
          "DRUGSTORES"
        ],
        "earn_rate": 5,
        "earn_type": "cashback_percent",
        "source_url": "https://www.nerdwallet.com/credit-cards/best/rewards",
        "source_last_verified": "2026-04-28T13:10:51.310Z"
      },
      {
        "rule_id": "base_1x",
        "categories": [
          "GENERAL"
        ],
        "earn_rate": 1,
        "earn_type": "cashback_percent",
        "source_url": "https://www.nerdwallet.com/credit-cards/best/rewards",
        "source_last_verified": "2026-04-28T13:10:51.311Z"
      }
    ]
  },
  {
    "id": "chase_sapphire_preferred",
    "issuer_id": "chase",
    "name": "Chase Sapphire Preferred",
    "network": "visa",
    "reward_unit": "points_multiplier",
    "reward_currency": "Ultimate Rewards",
    "base_earn_rate": 1,
    "reward_rules": [
      {
        "rule_id": "5x_travel_portal",
        "categories": [
          "TRAVEL_PORTAL"
        ],
        "earn_rate": 5,
        "earn_type": "points_multiplier",
        "source_url": "https://www.nerdwallet.com/credit-cards/best/rewards",
        "source_last_verified": "2026-04-28T13:10:51.311Z"
      },
      {
        "rule_id": "3x_dining",
        "categories": [
          "DINING",
          "GROCERY",
          "STREAMING"
        ],
        "earn_rate": 3,
        "earn_type": "points_multiplier",
        "source_url": "https://www.nerdwallet.com/credit-cards/best/rewards",
        "source_last_verified": "2026-04-28T13:10:51.311Z"
      },
      {
        "rule_id": "2x_travel_general",
        "categories": [
          "TRAVEL_GENERAL"
        ],
        "earn_rate": 2,
        "earn_type": "points_multiplier",
        "source_url": "https://www.nerdwallet.com/credit-cards/best/rewards",
        "source_last_verified": "2026-04-28T13:10:51.311Z"
      },
      {
        "rule_id": "1x_general",
        "categories": [
          "GENERAL"
        ],
        "earn_rate": 1,
        "earn_type": "points_multiplier",
        "source_url": "https://www.nerdwallet.com/credit-cards/best/rewards",
        "source_last_verified": "2026-04-28T13:10:51.311Z"
      }
    ]
  },
  {
    "id": "amex_gold",
    "issuer_id": "amex",
    "name": "American Express Gold Card",
    "network": "amex",
    "reward_unit": "points_multiplier",
    "reward_currency": "Membership Rewards",
    "base_earn_rate": 1,
    "reward_rules": [
      {
        "rule_id": "4x_dining",
        "categories": [
          "DINING"
        ],
        "earn_rate": 4,
        "earn_type": "points_multiplier"
      },
      {
        "rule_id": "4x_grocery",
        "categories": [
          "GROCERY"
        ],
        "earn_rate": 4,
        "earn_type": "points_multiplier",
        "excluded_categories": [
          "WHOLESALE_CLUBS"
        ],
        "notes": "4x on grocery stores (supermarkets). Explicitly excludes warehouse clubs like Costco and Sam's Club."
      },
      {
        "rule_id": "3x_airlines",
        "categories": [
          "TRAVEL_AIRLINES"
        ],
        "earn_rate": 3,
        "earn_type": "points_multiplier",
        "notes": "3x on airlines when booked directly with airline, not through travel agency"
      },
      {
        "rule_id": "base_1x",
        "categories": [
          "GENERAL"
        ],
        "earn_rate": 1,
        "earn_type": "points_multiplier"
      }
    ]
  },
  {
    "id": "amex_platinum",
    "issuer_id": "amex",
    "name": "American Express Platinum Card",
    "network": "amex",
    "reward_unit": "points_multiplier",
    "reward_currency": "Membership Rewards",
    "base_earn_rate": 1,
    "reward_rules": [
      {
        "rule_id": "5x_airlines_direct",
        "categories": [
          "TRAVEL_AIRLINES"
        ],
        "earn_rate": 5,
        "earn_type": "points_multiplier",
        "notes": "5x on flights booked directly with airlines"
      },
      {
        "rule_id": "5x_hotels_travel_portal",
        "categories": [
          "TRAVEL_HOTELS"
        ],
        "earn_rate": 5,
        "earn_type": "points_multiplier",
        "notes": "5x on hotels booked through Amex Travel or directly with hotel"
      },
      {
        "rule_id": "base_1x",
        "categories": [
          "GENERAL"
        ],
        "earn_rate": 1,
        "earn_type": "points_multiplier"
      }
    ]
  },
  {
    "id": "capital_one_savor",
    "issuer_id": "capital_one",
    "name": "Capital One Savor Cash Rewards Visa Signature",
    "network": "visa",
    "reward_unit": "cashback_percent",
    "reward_currency": "cashback",
    "base_earn_rate": 1,
    "reward_rules": [
      {
        "rule_id": "3x_grocery",
        "categories": [
          "GROCERY",
          "DINING",
          "STREAMING",
          "ENTERTAINMENT"
        ],
        "earn_rate": 3,
        "earn_type": "cashback_percent",
        "source_url": "https://www.nerdwallet.com/credit-cards/best/rewards",
        "source_last_verified": "2026-04-28T13:10:51.312Z",
        "excluded_categories": [
          "GROCERY"
        ]
      },
      {
        "rule_id": "8x_entertainment",
        "categories": [
          "ENTERTAINMENT"
        ],
        "earn_rate": 8,
        "earn_type": "cashback_percent",
        "source_url": "https://www.nerdwallet.com/credit-cards/best/rewards",
        "source_last_verified": "2026-04-28T13:10:51.312Z"
      },
      {
        "rule_id": "5x_travel_portal",
        "categories": [
          "TRAVEL_PORTAL",
          "TRAVEL_HOTELS"
        ],
        "earn_rate": 5,
        "earn_type": "cashback_percent",
        "source_url": "https://www.nerdwallet.com/credit-cards/best/rewards",
        "source_last_verified": "2026-04-28T13:10:51.312Z"
      },
      {
        "rule_id": "base_1x",
        "categories": [
          "GENERAL"
        ],
        "earn_rate": 1,
        "earn_type": "cashback_percent",
        "source_url": "https://www.nerdwallet.com/credit-cards/best/rewards",
        "source_last_verified": "2026-04-28T13:10:51.312Z"
      }
    ]
  },
  {
    "id": "capital_one_venture_x",
    "issuer_id": "capital_one",
    "name": "Capital One Venture X Business Travel Card",
    "network": "visa",
    "reward_unit": "points_multiplier",
    "reward_currency": "Miles",
    "base_earn_rate": 2,
    "reward_rules": [
      {
        "rule_id": "10x_travel_portal",
        "categories": [
          "TRAVEL_PORTAL",
          "TRAVEL_HOTELS"
        ],
        "earn_rate": 10,
        "earn_type": "points_multiplier",
        "source_url": "https://www.nerdwallet.com/credit-cards/best/travel",
        "source_last_verified": "2026-04-28T13:10:51.312Z"
      },
      {
        "rule_id": "base_2x",
        "categories": [
          "GENERAL"
        ],
        "earn_rate": 2,
        "earn_type": "points_multiplier",
        "source_url": "https://www.nerdwallet.com/credit-cards/best/travel",
        "source_last_verified": "2026-04-28T13:10:51.312Z"
      }
    ]
  },
  {
    "id": "chase_freedom_unlimited",
    "issuer_id": "chase",
    "name": "Chase Freedom Unlimited",
    "network": "visa",
    "reward_unit": "cashback_percent",
    "reward_currency": "cashback",
    "base_earn_rate": 1.5,
    "reward_rules": [
      {
        "rule_id": "5x_travel_portal",
        "categories": [
          "TRAVEL_PORTAL"
        ],
        "earn_rate": 5,
        "earn_type": "cashback_percent",
        "source_url": "https://www.nerdwallet.com/credit-cards/best/rewards",
        "source_last_verified": "2026-04-28T13:10:51.312Z"
      },
      {
        "rule_id": "3x_dining",
        "categories": [
          "DINING",
          "DRUGSTORES"
        ],
        "earn_rate": 3,
        "earn_type": "cashback_percent",
        "source_url": "https://www.nerdwallet.com/credit-cards/best/rewards",
        "source_last_verified": "2026-04-28T13:10:51.312Z"
      },
      {
        "rule_id": "base_1_5x",
        "categories": [
          "GENERAL"
        ],
        "earn_rate": 1.5,
        "earn_type": "cashback_percent",
        "source_url": "https://www.nerdwallet.com/credit-cards/best/rewards",
        "source_last_verified": "2026-04-28T13:10:51.312Z"
      }
    ]
  },
  {
    "id": "chase_sapphire_reserve",
    "issuer_id": "chase",
    "name": "Chase Sapphire Reserve",
    "network": "visa",
    "reward_unit": "points_multiplier",
    "reward_currency": "Ultimate Rewards",
    "base_earn_rate": 1,
    "reward_rules": [
      {
        "rule_id": "8x_travel_portal",
        "categories": [
          "TRAVEL_PORTAL"
        ],
        "earn_rate": 8,
        "earn_type": "points_multiplier",
        "source_url": "https://www.nerdwallet.com/credit-cards/best/travel",
        "source_last_verified": "2026-04-28T13:10:51.312Z"
      },
      {
        "rule_id": "3x_dining",
        "categories": [
          "DINING"
        ],
        "earn_rate": 3,
        "earn_type": "points_multiplier",
        "source_url": "https://www.nerdwallet.com/credit-cards/best/travel",
        "source_last_verified": "2026-04-28T13:10:51.312Z"
      },
      {
        "rule_id": "base_1x",
        "categories": [
          "GENERAL"
        ],
        "earn_rate": 1,
        "earn_type": "points_multiplier",
        "source_url": "https://www.nerdwallet.com/credit-cards/best/travel",
        "source_last_verified": "2026-04-28T13:10:51.312Z"
      }
    ]
  },
  {
    "id": "amex_blue_cash_preferred",
    "issuer_id": "amex",
    "name": "Amex Blue Cash Preferred",
    "network": "amex",
    "reward_unit": "cashback_percent",
    "reward_currency": "cashback",
    "base_earn_rate": 1,
    "reward_rules": [
      {